{
  "schema_version": "0.2",
  "graph_id": "audit:run-d7f8986d1ab24a04a6078f1afca17d1e",
  "source": {
    "type": "git_diff",
    "ref": "d5ef26deac6b1ed37ee9b89b52dddb1bcaac6c24..9a64e5a926d430a421a71b5cf433b0553876db28",
    "description": "Fireworks Tech Graph 本地 Git diff 审计"
  },
  "runs": [
    {
      "id": "run-d7f8986d1ab24a04a6078f1afca17d1e",
      "label": "Fireworks Tech Graph 代码变更审计",
      "status": "concerns",
      "summary": "这次变更显著加强了文档、fixture 和结构化校验框架，但碰撞检测仍存在多个可确定复现的漏报或误报路径，静态回归分支还会在 PNG 未导出时报告成功。当前 diff 存在 findings，不宜将其视为已经形成可靠的验证门禁。"
    }
  ],
  "nodes": [
    {
      "id": "change-001",
      "type": "change",
      "title": "Fireworks Tech Graph 变更",
      "summary": "共 21 个文件发生变更（+914/-281，其中 5 个二进制文件）。"
    },
    {
      "id": "file-001",
      "type": "file",
      "path": ".npmignore",
      "change_type": "modified",
      "additions": 2,
      "deletions": 0
    },
    {
      "id": "file-002",
      "type": "file",
      "path": "README.md",
      "change_type": "modified",
      "additions": 55,
      "deletions": 8
    },
    {
      "id": "file-003",
      "type": "file",
      "path": "README.zh.md",
      "change_type": "modified",
      "additions": 56,
      "deletions": 9
    },
    {
      "id": "file-004",
      "type": "file",
      "path": "SKILL.md",
      "change_type": "modified",
      "additions": 19,
      "deletions": 4
    },
    {
      "id": "file-005",
      "type": "file",
      "path": "assets/samples/sample-style1-flat.png",
      "change_type": "binary",
      "additions": 0,
      "deletions": 0
    },
    {
      "id": "file-006",
      "type": "file",
      "path": "assets/samples/sample-style2-dark.png",
      "change_type": "binary",
      "additions": 0,
      "deletions": 0
    },
    {
      "id": "file-007",
      "type": "file",
      "path": "assets/samples/sample-style3-blueprint.png",
      "change_type": "binary",
      "additions": 0,
      "deletions": 0
    },
    {
      "id": "file-008",
      "type": "file",
      "path": "assets/samples/sample-style6-claude.png",
      "change_type": "binary",
      "additions": 0,
      "deletions": 0
    },
    {
      "id": "file-009",
      "type": "file",
      "path": "assets/samples/sample-style8-dark-luxury.png",
      "change_type": "binary",
      "additions": 0,
      "deletions": 0
    },
    {
      "id": "file-010",
      "type": "file",
      "path": "fixtures/dark-luxury-style8.svg",
      "change_type": "added",
      "additions": 76,
      "deletions": 0
    },
    {
      "id": "file-011",
      "type": "file",
      "path": "fixtures/system-architecture-style6.json",
      "change_type": "modified",
      "additions": 1,
      "deletions": 1
    },
    {
      "id": "file-012",
      "type": "file",
      "path": "package.json",
      "change_type": "modified",
      "additions": 5,
      "deletions": 2
    },
    {
      "id": "file-013",
      "type": "file",
      "path": "references/style-6-claude-official.md",
      "change_type": "modified",
      "additions": 9,
      "deletions": 8
    },
    {
      "id": "file-014",
      "type": "file",
      "path": "references/style-7-openai.md",
      "change_type": "modified",
      "additions": 2,
      "deletions": 2
    },
    {
      "id": "file-015",
      "type": "file",
      "path": "references/svg-layout-best-practices.md",
      "change_type": "modified",
      "additions": 5,
      "deletions": 4
    },
    {
      "id": "file-016",
      "type": "file",
      "path": "scripts/README.md",
      "change_type": "modified",
      "additions": 16,
      "deletions": 8
    },
    {
      "id": "file-017",
      "type": "file",
      "path": "scripts/generate-diagram.sh",
      "change_type": "modified",
      "additions": 2,
      "deletions": 2
    },
    {
      "id": "file-018",
      "type": "file",
      "path": "scripts/test-all-styles.sh",
      "change_type": "modified",
      "additions": 42,
      "deletions": 4
    },
    {
      "id": "file-019",
      "type": "file",
      "path": "scripts/validate-svg.sh",
      "change_type": "modified",
      "additions": 21,
      "deletions": 229
    },
    {
      "id": "file-020",
      "type": "file",
      "path": "scripts/validate_svg.py",
      "change_type": "added",
      "additions": 484,
      "deletions": 0
    },
    {
      "id": "file-021",
      "type": "file",
      "path": "tests/test_validate_svg.py",
      "change_type": "added",
      "additions": 119,
      "deletions": 0
    },
    {
      "id": "finding-001",
      "type": "finding",
      "category": "bug",
      "severity": "medium",
      "status": "open",
      "title": "任意包住至少两条完整箭头的普通障碍物都会被当成 `legend`，其内部箭头因此完全绕过碰撞检查。",
      "detail": "`legend_bounds` 仅按“边是否完整落在边界内”推断，随后直接 `continue`，没有核验 `data-graph-role`、元素身份或文本；一个包含多条业务流的填充面板会使其中所有边与内部节点的真实碰撞被漏报。",
      "fingerprint": "sha256:07201a4aae1fcce9fc0dc0d75ed61a4410d0056aa8ae312c3187136c371d75e9",
      "extensions": {
        "change_audit": {
          "review_finding_id": "f-001",
          "original_category": "logic_error",
          "confidence": "plausible"
        }
      },
      "file_path": "scripts/validate_svg.py",
      "hunk_id": "hunk:2bddf7282f8e58a1:1:1",
      "start_line": 415,
      "end_line": 415,
      "line_side": "new",
      "highlight_lines": [
        415
      ],